{
	"permissions": ["readState", "writeState", "localStorage"],
	"blueprints": [],
	"components": [
		{
			"name": "Main",
			"type": "Panel",
			"entry": "ShopPage.js",
			"html_template": "ShopPage.html",
			"css_template": "ShopPage.css",
			"panel_location": {
				"pageID": "system.ModuleShop.Main",
				"slot": "page-content"
			},
			"component_dependencies": []
		}
	],
	"module_dependencies": []
}